username,comment,date,platform
7 tahun yang lalu,wakakakak coklat tawar asli ngakak son ! :3,@TAMPANGAMING,youtube
7 tahun yang lalu,ABSEN MALMING JOJOBA BANG !!!,@Ranggaoke40,youtube
7 tahun yang lalu,muka bikenkrim lagi bangun tidur,@brydenrenald6776,youtube
5 tahun yang lalu,amin,@hagann2MP,youtube
7 tahun yang lalu,"Gua:Hari Apa Yg Lebih Serem Dari Malam Minggu ?
TemenTroll:Hari Terakhir Libur Hahahahaha",@yumerizuki4594,youtube
7 tahun yang lalu,TECH SUPPORT BEACONCREAM MANA SUARANYA BUKTIKAN SUBS TECH SUPPORT BEACONCREAM ITU BANYAK DAN SELALU DUKUNG DIA  CHANNEL INI KITA TUNJUKKAN BAHWA KITA SUPORTER BEACONCREAM,@beaconcreamtechsupport9480,youtube
7 tahun yang lalu,malam minggu Anti MainStream :v,@RoyaleTime29,youtube
5 tahun yang lalu,Dan sampe sekarang Abang belom dapet jodoh dan sekarang 2020bang,@hy-fz4jg,youtube
7 tahun yang lalu,"Kak nelson buat series minecraft comes alive nanti di minecraft biar gak jojoba ,,,!! Ya tapi didunia nyata masih tetep mungkin  .                Mungkin jojoba   


Nanti biar kak nelson bisa milih cewek",@RieFunggi,youtube
7 tahun yang lalu,Malming gagal diettt yooo ketahuan makan cocoa  kapan dietttt nangg ntar gendut lohh,@nazwarahmawanti9967,youtube
7 tahun yang lalu,SEMOGA CHENNEL BANG BEACON MAKIN SUKSES,@lunacraft7595,youtube
4 tahun yang lalu,Nostalgia waktu dulu bang beaconcream bikin aku seneng waktu nangis,@darentliem9120,youtube
7 tahun yang lalu,"Coklat ksh sayang ancur apakah itu alasan kak nelson selalu jomblo :v 
Coklat anti galau - buat move on (emang punya mantan ya ?)
Coklat enteng jodoh - bang....cowok kan ?? (Putih manis= manis masa pacaran, coklat agak pait= pait ketika putus wkwkwk)
Coklat makin cinta - CINTA SUBS SELALU NO 1 !!!!!!
ITU KOK ADA SUARA CEWEK .... PACAR BARU YAAAAA~~~ SIAPA ITU BANG ??
(semuanya cmn candaan doang)",@feliciafelice2544,youtube
7 tahun yang lalu,Semoga kak Nelson makin cepet-cepet punya jodoh...,@alfiiyhz,youtube
7 tahun yang lalu,Ahhhhh.... Jadi Baper liat kak nelsol jomblo jadi kasihan.,@BTSARMY-cx3ce,youtube
6 tahun yang lalu,Siapa yg disini jomblo :(:(:(,@satriavicoc.3146,youtube
7 tahun yang lalu,Bang buat build battle dong bareng 4brother,@skybluex11,youtube
7 tahun yang lalu,bang nelsoon gw rasa kalo vlog dirumah kayak bang erpan tepuk tangan nya,@alurbiasa1403,youtube
5 tahun yang lalu,": mungkin coklat ini menunjukan bahwa kita harus muf on
Aku:emang bang BEACONCRAEM udah pernah pacaran ya",@elsanih9706,youtube
4 tahun yang lalu,kak nelson lucu lucu banget,@alekharalekhar8959,youtube
7 tahun yang lalu (diedit),"JoJoBa
adalah jomblo2 bahagia 
yg sebenernya tidak bahagia
dan sok cool aja hidupnya kayak gk ada masalah tapi di balik itu muehehehe",@dzakyfwp3256,youtube
7 tahun yang lalu,selamat malming bang jojoba. semoga gak jomblo lagi biar abang gak jadi om om genit yang muncul dimalam minggu,@skouskies,youtube
7 tahun yang lalu,Gw jadi pingin coklat :v*,@sugengbudiyanto5333,youtube
3 tahun yang lalu,Nostalgia,@JAGOANGS,youtube
7 tahun yang lalu,Bang itu yang ngerekam cewek ya siapa bang plies jawab dong bang iya ga guys,@hasanbrb7370,youtube
7 tahun yang lalu,Siapa ngiler coy ama coklat ini,@kartonovivo4817,youtube
7 tahun yang lalu,Bang? Knp coklat? Gatau penderitaan cwe lg diet kah? tar ku jd gendut ku salahin kamu yha xD  *jk :v,@cixie_9123,youtube
5 tahun yang lalu,Nel req mukbang coklat 100% kakao coklat monggo,@Akellelelelelellelell,youtube
7 tahun yang lalu,Coklat anti miskin atau tambah miskin ya??? Soalnya kalo beli jadi tambah miskin,@GAMECHANNEL-ll4fy,youtube
6 tahun yang lalu,Itu Coklat Fav. Ku,@repacakep7903,youtube
7 tahun yang lalu,BANG ITU SIAPA,@widi.hartanto1282,youtube
5 tahun yang lalu,Ada yg nyadar gk suara orang yg vidio in bang nelson kyk suara kak mutia safira,@jekyjeni2706,youtube
7 tahun yang lalu,Kak di joogja. Juga ada coklat itu,@afongmana7654,youtube
7 tahun yang lalu,Bang Sapa Yang Ngomong waktu Coklat rasa sayang nya hancur Kayaknya Suara Cewek ??? ;|,@forstdark8809,youtube
7 tahun yang lalu,Jadi pengen,@dzaky_prime4020,youtube
5 tahun yang lalu,Aku pernah beli di garut arah nagreg banyak banget,@tukijo1732,youtube
7 tahun yang lalu (diedit),"Nama Coklatnya Bikin Ngakak
Edit: Coba Ada Coklat Bikin Pintar Pelajaran MTK :v",@robokochan9486,youtube
6 tahun yang lalu,Woi bantu bang nelson 2juta sucsriber plaisee,@shayyengaming9266,youtube
7 tahun yang lalu,Bikin baper eh keceplosan bikin laper gitu,@fahmimaulana6220,youtube
3 tahun yang lalu,Udah berkali-kali nonton ini tapi tetap ngakak,@karimlim1552,youtube
7 tahun yang lalu,"MAKANLAH MAKANAN YANG BAIK NAK.....XD
wkowkowkowk",@danir.h5118,youtube
5 tahun yang lalu,"ya memang ada bang mesti kalau di kasir selalu ada permen2 gituu,aku jg pernah liat",@tizcloudys_1249,youtube
5 tahun yang lalu,Coklat rasa sayang atau coklat rasa tawar,@izzatulfatihah4867,youtube
5 tahun yang lalu,ngakak,@yohanesagung8324,youtube
7 tahun yang lalu,Ngiler banggg!!,@pycegamingch1643,youtube
7 tahun yang lalu,kak nelson setiap malam mingu buat begini lagi donk?,@herogt5481,youtube
2 tahun yang lalu,"Ada yg nonton di thn 2023 ga? 
Apa cuma aku doang??!!",@angelicagaming08,youtube
1 tahun yang lalu,Kenapa ga aplod di NeruNeruSon bang,@Zaaifah_62,youtube
7 tahun yang lalu,Aku kalo liat makanan jadi lapar,@niknok6738,youtube
6 tahun yang lalu,"Bang, yg jadi kameramen siapa bang? Kakak abng yah? Apa cewek abng? 


Suaranya perempuan",@flexzplayz5704,youtube
5 tahun yang lalu,"Itu juga ada coklat ""Kece badai""",@puyatheburpu2802,youtube
5 tahun yang lalu,"Astagaaa,gw udh nonton ini berulang kli,tp ga bosen2",@sayyidahaliiffah3746,youtube
7 tahun yang lalu,"Untung g ad coklat rasa yg dlu pernah ada ya :'v

+Beacon Cream",@Kazuki_02,youtube
5 tahun yang lalu,"Apakah hanya gw yg nonton vidio ini 2020
Yg sama likes",@keluekrblx6370,youtube
7 tahun yang lalu,"Bang,aku mau nanya kamu setiap video pasti ngomongin tentang pacar emang kamu jomblo ya,terus kamu umur berapa sama kelas berapa tolong di jawab ya bang nelson",@wilhya5129,youtube
5 tahun yang lalu (diedit),Kalo aku setiap pulang dari bandung harus beli semua coklat itu aku beli coklat itu yg tulisannya aku cinta kamu  padahal... Aku jomblo,@kirana4405,youtube
5 tahun yang lalu,bang nelson 2017: semoga aku gak jomblo lagi,@heigelritonga483,youtube
7 tahun yang lalu,Bang abang super ya suka baper sampe makan coklat tahan baper aku sih juga super suka baper udah umur 17 taun belum ada mantan apalagi aku pernah liat orang pacaran sejak itu aku super suka baper ya sampe aku nangis nangis ya tapi kata temen aku yang udah punya mantan yang sabar yaudah akusih sabar aja terus orang yang lagi pacaran tiba tiba berantem terus aku liat lagi coba dunia mamang tidak benar,@Laras-gx3tp,youtube
7 tahun yang lalu,Bang kapan room tour??,@ryand14,youtube
5 tahun yang lalu,Ih Ampuh loh buktinya Skrng Dapet Sarah Piloid Semoga Beneran jadian :3,@sweettea278,youtube
7 tahun yang lalu,Bang kalo mau jodoh di minecraft abang main comes alive yang setuju like,@lubnaayesha8883,youtube
5 tahun yang lalu,"Gw pernah makan coklat merek itu 
Tapi tulisannya ""coklat anti miskin""",@lezer2086,youtube
4 tahun yang lalu,2021 bang Nelson masih memegang gelar jojoba veteran,@ghous-ns6be,youtube
5 tahun yang lalu,dia bicara lagi Abang Nelson siapa kameramenya,@sulfangans7788,youtube
7 tahun yang lalu,11× ditonton 40 like... Youtube logic lagi..,@lufkeyy,youtube
7 tahun yang lalu,COKLAT ENTENG JODOH AKU PERNAH MAKAN ENAK CEPET ABIS  PAS LAGI TUKER KADO SAMA SAUDARA !,@azkaezx,youtube
7 tahun yang lalu,Babang biken kapan maen smp s3 lagi bang?,@muhammadhaykalabdillah6967,youtube
1 tahun yang lalu,nostalgiaaaaa,@jaeinra,youtube
7 tahun yang lalu,bang room tour 400k,@rezamuhammad2110,youtube
7 tahun yang lalu,Enak nih,@bagas_gamersgemer610,youtube
6 tahun yang lalu,Gw pernah beli yg tolak miskin :v,@bluh9149,youtube
6 tahun yang lalu,Cieeee sama kak mutia,@lucreshiana5881,youtube
5 tahun yang lalu (diedit),"Udah tahun 2020 masih aja jombloooooooooo
Sama kok, jomblo",@jenartria759,youtube
5 tahun yang lalu,Sskarang menjelang 2020 dan tak kunjung mendapatkan jodoh,@ikanpunya622,youtube
6 tahun yang lalu,Cokelat di Gramedia yang gua tinggalin,@maryantoindragunawan7494,youtube
5 tahun yang lalu,Wwkkwkwk cokelat enteng jodoh pahit wkwkwk btw bang siapa kameramen nya kok sepertinya wanita???,@Yudastadeuskk,youtube
7 tahun yang lalu,Bang itu siapa yang megang kamera siap bang?,@annisakhumaira6209,youtube
6 tahun yang lalu,wah ada ya cokalat jodohh semoga aja ka nelson dapat jodoh yang setia suka solat dan membantu ka nelson amin,@Eko-up1ob,youtube
5 tahun yang lalu,"Bang nelson bisa tunjukan  muka asli
Kamera men nya?",@aryaahmadfaraby5528,youtube
5 tahun yang lalu,Semoga bang Nelson semoga enteng dapat jodoh dan semoga dapat banyak rasa sayang dari jodohnya,@andreafranciliano7688,youtube
5 tahun yang lalu,Siapa yg nonton di 2019 bulan Desember tanggal 6 jum'at like ok,@VENOManjay-mr8fm,youtube
7 tahun yang lalu,Bang kalo makan coklat banyak banyak nanti tamba gendut loh,@putrii7802,youtube
7 tahun yang lalu,kak itu kalau yang coklat laki laki kalau yang putih cewek :v,@aisyahhassna1011,youtube
5 tahun yang lalu,"Old :  
New :",@ketutsudita3081,youtube
6 tahun yang lalu,Itu yg suara cewek siapa,@bayu692,youtube
7 tahun yang lalu,Ke banyakan makan coklat nanti sakit gigi,@rofaahmad5239,youtube
6 tahun yang lalu,Yang nonton 2019 mana nih?,@senangitubaik681,youtube
6 tahun yang lalu,Malah jadi sowswit,@hendrikoto1891,youtube
6 tahun yang lalu,Neruneruson versi low budget :v,@ikhwal,youtube
7 tahun yang lalu,JojoBA,@zidanneuy9199,youtube
6 tahun yang lalu,Hmmm yang megang kamera itu cewek apa cowok tapi kelihatan dari suara nya cewek nih wkwkwkkw jawab bang Nelson siapa yang megang kamera itu cowok apa cewek,@oncom1768,youtube
6 tahun yang lalu,"Bang sebenernya itu gak tawar lho, abang kan udah makan banyak coklat tuh rasanya beda-beda kan? Ya itu karna semua coklatnya itu manis, cuma kalau kita makan manis terus habis itu makan yg manis juga pasti rasanya tawar:D",@rice6248,youtube
7 tahun yang lalu (diedit),Koq cuma bikin laper yak :v,@aisyah923,youtube
5 tahun yang lalu,Kalender nya samaa:v,@araadoang3395,youtube
5 tahun yang lalu,"Nelson kamu 2020 tidak bisa dapat  
Pacar sampai 2029",@arohilmjee4386,youtube
5 tahun yang lalu,Kak biken kok selalu membuatku senang,@khanzadiandra3517,youtube
6 tahun yang lalu (diedit),Aturan record nya di NeruNeruSon soalnya makan nan,@attahalilintar1728,youtube
7 tahun yang lalu,bang gua pernah beli di gramedia citra land mall,@fxiwandjangun903,youtube
6 tahun yang lalu,Mungkin rasa sayang bang Nelson hancur,@abdulghani6257,youtube
3 tahun yang lalu,"Ada yang nonton 2022?


Lagi ngapain bos",@mrbeansX-900,youtube
6 tahun yang lalu,aku baru tau kalo.video.ini di up pas gw lgi ultah anjir,@aryasatriaa,youtube
5 tahun yang lalu,Anjay coklat dari garut :v,@Intakkoyaki,youtube
5 tahun yang lalu,Aku cinta kamu nelsion ️️️️️️️️️️️,@alfafainsanmuliawan2270,youtube
7 tahun yang lalu,bang gimana perasaan lo jadi jojoba,@kocakgaming6313,youtube
6 tahun yang lalu,"Asli garut kalo g salah 
(chocodot)",@bivedgt,youtube
6 tahun yang lalu,2019 ok,@iqbalgilbranofficial7861,youtube
6 tahun yang lalu,Bang nelson lagu nya kayak nya pernah dengar si roblox baby simulator,@ekasyahrony9954,youtube
7 tahun yang lalu,2018?,@ikonlove1913,youtube
7 tahun yang lalu,"Bang Kalori Coklat Itu Banyak Loh
Nanti Abang Malah Tambah GENDUT
Jadi Diet Biar Kurus Ya",@BabyChibi,youtube
7 tahun yang lalu,Bang yang kamerain lu siapa bang?,@Lightness02,youtube
3 tahun yang lalu (diedit),anjayy,@Grønval,youtube
7 tahun yang lalu,siap bang,@bryanchristopher687,youtube
7 tahun yang lalu,Nelsooon,@Gilamen-cq4ek,youtube
7 tahun yang lalu,167 like 38xviews wow!!,@onmy_craft3044,youtube
5 tahun yang lalu,Gw tau kenapa abang masih belum dapat rasa sayang :V soalnya coklat rasa sayang yg abang banting itu menandakan abang telah membanting-banting rasa sayang abang sampe sampe rasa sayang abang hancur :V,@sepnopok1258,youtube
7 tahun yang lalu,FIRST,@bagas6881,youtube
7 tahun yang lalu,bang itu abang sama siapah,@sidikjaya4336,youtube
6 tahun yang lalu,Bang ada suara cewek pacar ya bang,@alika_chab2616,youtube
7 tahun yang lalu,Jones sih,@masterboygaming1734,youtube
6 tahun yang lalu,"Bang nelson kayak ada suara cewek siapa itu bang
??????",@muhammadraffa3289,youtube
6 tahun yang lalu,Bang Nelson udah punya pacar belum  cream,@zokigon142,youtube
4 tahun yang lalu (diedit),"2017: SOMEGA DAPET JODOH
2021: hampir dapet nih si sarah


Makasih untuk 0 like",@glovesadventure30yearago23,youtube
5 tahun yang lalu,"Bang reaksion gacha life dong~
Yg setuju like",@Mutia_official-tb4hh,youtube
7 tahun yang lalu,Kamu orang apa bang Nelson,@indahputrigachaarmy5274,youtube
6 tahun yang lalu,Dan sampe 2018 bang Nelson belum dapat jodoh :'),@dzakia89dyaz31,youtube
4 tahun yang lalu,Kukira selama ini gramedia toko buku :v,@safad6848,youtube
7 tahun yang lalu,Siapa nonton sebelum 100 Like,@martine8644,youtube
6 tahun yang lalu,Bang itu suara cewe .jangan jangan . pacar cieeee,@pandapowkwkwk3097,youtube
7 tahun yang lalu,Kakaknya ngiler gak bang :V,@ihsan88082,youtube
4 tahun yang lalu,Di gramedia memang ada permen dan coklat di dekat kasir.,@lndexiawebster6824,youtube
6 tahun yang lalu,Berarti banyak kegalauan ditanggal dan bulan lahir ku: v,@GanForger,youtube
7 tahun yang lalu,Minta,@manther_youber_geming6527,youtube
6 tahun yang lalu,"Enak jomblo kak dari pada sakit hati kakaknya kalo pacaran itu haram, bikin uang habis kakak (tapi aku cewek yang disakiti kak udah gak usah pacaran sama orang, sama aplikasi aja dah aku kembali jones dan kembali johap",@salsabillasanjaya9257,youtube
5 tahun yang lalu,Bang tau jomblo bang kalau makan coklat byk byk ntar sakit gigi jadi jelek gigi nya nanti siapa yg mau bang,@anderson-ye6oc,youtube
7 tahun yang lalu,Gramedia??????  Maksud?????,@ihsan88082,youtube
6 tahun yang lalu,Siapa yang megang hpnya .,@najwanaliyasir4077,youtube
6 tahun yang lalu,Aku udah beli ternyata enak lo.(bukan sombong plis ),@ainuntriwulandari6380,youtube
5 tahun yang lalu,Aku sudah pernah makan coklat itu,@fajarcahyonugroho819,youtube
7 tahun yang lalu,Anjay bang :V,@nebarisasi,youtube
7 tahun yang lalu,bang yang rekam itu pacarnyanya,@bobigantenggaming2084,youtube
5 tahun yang lalu,Ampe sekarang belom dpt jodoh wkwk,@stevandewo991,youtube
5 tahun yang lalu,Jomblo!!  kan jodoh ditangan yang kuasa,@nur_rahma_apriliyanti7788,youtube
5 tahun yang lalu,Manis kayak akuuu :3,@feibenayoan4032,youtube
5 tahun yang lalu,Si son pura-pura mati tapi vidios good juga ya selamat son biar 10000000subs ya,@yanamulyana6506,youtube
5 tahun yang lalu,Jadi pengen padahal puasa T_T,@heldalita952,youtube
5 tahun yang lalu,Kocak njeeer,@ikirman,youtube
5 tahun yang lalu,"Halo beacom cream aku fans sm kamu loh , aku umur 5tahun tiap Hari aku nontonin channel youtube kami, Salam dari jambi",@teddyjambi3211,youtube
6 tahun yang lalu,bang yang pegang kamera nya pacar abang kah tapi gak papa sih lan dari dulu abang mau pacar eaaa,@atsilahalfaraz7586,youtube
5 tahun yang lalu,Abang suara siapa itu,@ryanfakhriz1111,youtube
4 tahun yang lalu,Saya Vios lama bang bikin cream Saya nonton terus episode-nya,@naysillaadien6219,youtube
4 bulan yang lalu,Perfect cut,@SUPERZ-NinjaHandal,youtube
6 tahun yang lalu,Bang biar aku bantuin kaka dimana rumah kaka aku fans kak jadi aku pengen bantuin kaka team,@ekayuliana9165,youtube
5 tahun yang lalu,kak bikin video vr kak,@rehanaldi1796,youtube
6 tahun yang lalu,Oku doain bang biken dapat jodoh amin yang setuju like,@niaamaliatandibiringipa7922,youtube
5 tahun yang lalu,Chocodot itu bikinan khas garut,@guruyenihandayani3448,youtube
5 tahun yang lalu,Semua cholkat manis kaleee,@salsa3126,youtube
5 tahun yang lalu,coklat itu manis gak,@saralissa8360,youtube
5 tahun yang lalu,2 3 merasa sayang hantu jawab jawabannya adalah cinta diri sendiri,@suyantimayang3997,youtube
5 tahun yang lalu,Itu coklat dr garut,@tukijo1732,youtube
5 tahun yang lalu,ka beaconcream bikin giler tau lagi puwasa,@firasabdullah4050,youtube
6 tahun yang lalu,Bang kok di chanel beacon crean bukan di chanel neru neru son,@rafka505,youtube
4 tahun yang lalu,memang bang,@Rezania4758,youtube
6 tahun yang lalu,Nelson ganteng buat vidio mini world,@robigaming6643,youtube
5 tahun yang lalu,"Itu coklat khas Garut bg
Soalnya aku org Garut
Dan kalo abg ke toko dodol pasti ada yg jual coklat ituu",@nuranisa6830,youtube
5 tahun yang lalu,"Gw mau ngumpulin orang orang yang jomblo


Absen di Bawah y",@tktokfoodies3780,youtube
5 tahun yang lalu,Wkwkwkwk lucu kak,@ZuraaKazima,youtube
5 tahun yang lalu,Aku pernah beli di Cirebon Jawa barat di batik Trusmi Cirebon,@kartinijajang5311,youtube
5 tahun yang lalu,Bang kapan main Minecraft parkornya,@marcellinorf7774,youtube
6 tahun yang lalu,Aku aja di gramedia pernah beli permen 5 toples,@dweicentounos,youtube
3 tahun yang lalu,Semua nya jaman dulu,@RaizelPlayzz,youtube
5 tahun yang lalu,Bang lucu banget masa gramedia jualan coklat  tapi kalau di pikir pikir  boleh juga,@dewintaminasari6082,youtube
6 tahun yang lalu,Enak bang...pasti enak,@fifinyuliah6170,youtube
6 tahun yang lalu,Bang  punya  chenel 2 ya (Neru Neruson)????,@muhammadlutfi6689,youtube
6 tahun yang lalu,"Ada Suara Wanita Yang Bilang Oh No Yang Berati BeaconCream Gak Jomblo 
2
  0
    1
       9
?????????",@FelixRaymond.,youtube
6 tahun yang lalu,bang di transmart ada gk,@gilbertulag4935,youtube
5 tahun yang lalu,Katanya jomblo tapi kok ada suara cewek,@sabrinaxatesa,youtube
5 tahun yang lalu,"baru sampay sekarang masih belom 
dapat jodoh wkkwkwkwk",@warlianyhamid6306,youtube
5 tahun yang lalu,Bang itu banyak banget dijual di garut pas arah nagreg,@tukijo1732,youtube
5 tahun yang lalu,bang itu siapa yang ngamerain mana suaranya cewek,@nonaceriwis9282,youtube
5 tahun yang lalu,Bang itu siapa yang megang kameranya,@mr.elvand5507,youtube
6 tahun yang lalu,Di gramedia ku ada makanan makanan di kasirnya,@unmarkedgt8861,youtube
5 tahun yang lalu,Bang abang tahu gak itu coklat buatan om saya tahu bang :) kadang kadang kalo lebaran ke kampung sering di kasih bang :),@starlight2787,youtube
4 tahun yang lalu,Ini dibuat dari 2017.... Dan sekarang 2020 Nelson masih jomblo..... :V,@papiruu2481,youtube
4 tahun yang lalu,Bang bikin pidio yang painng seru lagiya,@yuja_channel,youtube
5 tahun yang lalu,Di neruneruson dong hrsnya.,@bambangparto301,youtube
6 tahun yang lalu,Coklat anti jomblo,@azkanugraha40211,youtube
6 tahun yang lalu,"Kak nelson yg pegang cameranya itu siapa?




Harus jawab!",@cacaaa6726,youtube
6 tahun yang lalu,Bang mainin sonik ekse,@rucanputra8137,youtube
5 tahun yang lalu,Jadi ngiler,@jonathancornellius9388,youtube
6 tahun yang lalu,bang lu belinya di gramedia BEC bukan sih soalnya disana ada,@josuaaritonang1220,youtube
6 tahun yang lalu,Gramedia yang dimana bang?,@alissaaaa4,youtube
5 tahun yang lalu,Bang yang pegang kamera siapa???,@m.fadillah6892,youtube
5 tahun yang lalu,Kakak ke papbrik chocodotya sama aku juga pernah kesana beli boneka nya,@avril3571,youtube
6 tahun yang lalu,Bikin draw my life dong kakk,@brocoligamer8233,youtube
5 tahun yang lalu,Bang beacon beli semua coklat itu dimana,@bacongaming6714,youtube
6 tahun yang lalu,Anti galau banget ya kak,@thaaarachive,youtube
5 tahun yang lalu,Kaka beacon cream yuk main roblox saber simulator lagi,@LukmanHakim-me4fq,youtube
1 tahun yang lalu,Apakah ini fosil,@mandm-x3b,youtube
5 tahun yang lalu,Gw pas banget nontonya di malam minggu,@xmb_5718,youtube
5 tahun yang lalu,Itu yang Kameramen dan pas lagi pas lagi Abang lagi makan coklat itu capek nggak marah itu jodoh adng,@dei537,youtube
5 tahun yang lalu,Muka kak beaconcream mirip banget sama kak nelson di cenel Neruneruson yang sudah tau di like   ya,@Tavvv33,youtube
3 tahun yang lalu,Bang coba abang main dengan hayo_go dan bang cupu official mereka youtuber,@fxartistofficial5155,youtube
4 tahun yang lalu,Sedih amat ya beaconcream  makan coklat sendiri main game sendiri tidur sendiri mukbang sendiri makan sendiri kasian sih tapi jangan menyerah bang Nelson,@wibusetengah1513,youtube
4 tahun yang lalu,Akhirnya jojoba kembali :v,@aiman7259,youtube
3 tahun yang lalu,Nostalgia,@Ampl1fic4tion,youtube
5 tahun yang lalu,hahaha,@rina.w6634,youtube
6 tahun yang lalu,Bang itu yang ngerekam nya siapa,@narindraialhakiim3951,youtube
6 tahun yang lalu,Bang abang ama siapa,@adeibrahim9291,youtube
6 tahun yang lalu,bang bagusan yang mana  atau,@temptemp8957,youtube
6 tahun yang lalu,Bang kameramen abang cewe ya bang,@dheyunengsih6910,youtube
6 tahun yang lalu,jadi laperrr deh,@nafsiyahhj1478,youtube
5 tahun yang lalu,Bang kamen ramenya mutia ya,@azrielgeming0259,youtube
5 tahun yang lalu,Bang nelson pernah dekat channel NeruNeruson,@NeonWhitty,youtube
4 tahun yang lalu,Aku nonton ini sambil makan kurma coklat,@Hann_sfp,youtube
5 tahun yang lalu,Itu makanan dari kampung gw di garut itu makanan favorit ge,@aqillarinualdychandra5152,youtube
6 tahun yang lalu,Wah cokelat nya kayak nya enak,@saikikusuonownan677,youtube
5 tahun yang lalu,"Pas Kakaknya/Saudaranya/Apalah Bodo amat :v ngomong ""jatuh jatuh Gaes"" kayak suara Muthia Savira Wkwk :v",@helloeveribady6019,youtube
5 tahun yang lalu,"Bang nel aku juga pernah makan chokodot enaknya minta ampun, tapi belinya di kampung",@googleyoutube7042,youtube
6 tahun yang lalu,Assalamualaikum bang beacon,@bayuzahranarrabi4601,youtube
6 tahun yang lalu,Kak main meepcity dong,@andibalquesrasty3515,youtube
6 tahun yang lalu,Ada yang nemenin ya soal nya ada suara cewek dari kameramen ci yyyeeeeeeyy,@afrartofficial4178,youtube
6 tahun yang lalu,Nguyah Mulu engak cape apa,@reisyaziami3320,youtube
6 tahun yang lalu,Gua punyanya coklat tolak miskin,@karasunov8671,youtube
5 tahun yang lalu,Nolson sudah punya pacar apa belomya?,@krisnadharma5502,youtube
5 tahun yang lalu (diedit),2 hari setelah kelahiranku hari valentine :),@riobirhamulloh425,youtube
5 tahun yang lalu,Bagus bang,@1kzggamer257,youtube
6 tahun yang lalu,Bang beacon tinggal di mana,@bayolubis1125,youtube
6 tahun yang lalu,Beacon cream punya pacar yg rakam itu kan cw,@khalidpidani3737,youtube
5 tahun yang lalu,Buat hidio cokelat lagi ok,@WahyudiYudi-kz7lh,youtube
5 tahun yang lalu,2020?,@spongebobgaming9887,youtube
6 tahun yang lalu,"Abang yg megang kamera siapa ,pacar Abang kah?",@dimasdarmawan5242,youtube
5 tahun yang lalu,"-_-aku juga suka 
Coklat dan juga suka aetoberi",@nijamgemink6095,youtube
4 tahun yang lalu,jangan lupa sikat gigi kalau suda makan kak nelson,@ratripatresia0989,youtube
5 tahun yang lalu,"Bang, cari pacar sono.. jangan rebahan melulu >:v udh 2020 nih.. :vv",@ishakeinik,youtube
6 tahun yang lalu,Sama muthia savira ya makan coklatnya,@timmyyt6901,youtube
5 tahun yang lalu,2020 siapa,@yusufpombatu6154,youtube
6 tahun yang lalu,Kakak udh manis ngapain makan yg manis manis lagiii,@AydiwScortovio,youtube
6 tahun yang lalu,"Di menit  itu pacar mu ya bang becon , oiya bang tetap semangat bikin Vidio nya ya bang saya selalu like Vidio Abang (kolo sempat ditonton :v) yg penting saya dukung Abang terus supaya subscribe nya banyak 

 CREAM (I LOVE YOU ) (No GAY :V)

TAMBAHAN



ASLI DAH AKU BANYAK BACOT DEH KAYA ORANG CERAMAH :V",@ryantwg5021,youtube
5 tahun yang lalu,Bikenkerim siapa yang rekam fidio abang,@ovlykadir6797,youtube
5 tahun yang lalu,Kenape enga di nero n,@haianboxing7200,youtube
5 tahun yang lalu,Kak aku mau nanya siapa yang merekam kakak ya?,@ramliramli2651,youtube
6 tahun yang lalu,Bang nelson ada suara cewek dia yang megang kamera nya ya dia adek atau kakak,@vionacakep9164,youtube
5 tahun yang lalu,Kak beli dimana coklatnya,@zhabrinah0341,youtube
5 tahun yang lalu,Kok ada yng tawar? Brarti sayang donk duitnya :v,@dianwahyudi1303,youtube
5 tahun yang lalu,beli coklat nya dimana,@semiajigunawan126,youtube
5 tahun yang lalu,Hmmm aku masa depan ya 2020 nonton nya,@nyehmnyehy611,youtube
5 tahun yang lalu,cie bang nelson punya pacar,@febriandaalexa1333,youtube
5 tahun yang lalu,Yang ngerekam tu kk abang ya??aww so sweet,@shalimmuarif4596,youtube
6 tahun yang lalu,Coklat tawar itu pengaruh dari gk ada jodoh,@kontoruchannel8745,youtube
6 tahun yang lalu,Cokelatnya enak tuh,@fatmachannel-3062,youtube
6 tahun yang lalu,Itu sore bang ne ls on,@onefaceyourbae9549,youtube
6 tahun yang lalu,Kak itu mah Cokodot:coklat dodol. Itu coklat asli garut. Aku suka beli yang rasa sayange. Hehe,@yuna-nfh8,youtube
6 tahun yang lalu,Itu pacar abang yang Bawa camera,@spyx7814,youtube
6 tahun yang lalu,"Kak nelson kalau di garit itu harga persatunya itu 35k,,,,,,salam orng garut.....",@mamahdiva4297,youtube
6 tahun yang lalu,Ih mau Dong coklat nya,@yunipassolle8348,youtube
6 tahun yang lalu,Jomblo setia deh wkwkwkwk,@Yes-mf8kr,youtube
5 tahun yang lalu,Bang nelso yang ngevidio siapa sih kok kayak suara cewek,@mrantz4756,youtube
5 tahun yang lalu,Ngebucin bang Nelson,@mhmmdbianda,youtube
6 tahun yang lalu,Kak semoga cintanya tercapai,@nyomanmaharini6239,youtube
5 tahun yang lalu,"Beaconcreamr
Kayra",@syalqiaarief8307,youtube
5 tahun yang lalu,KEK BANGUN TIDUR NJIRR :D,@egelagang,youtube
5 tahun yang lalu,Bang rebahan main roblox plss,@vidhelio,youtube
5 tahun yang lalu,Beaconcream makan cokelat nanti gemok,@rika7438,youtube
5 tahun yang lalu,Jadi ngiler,@dwiaryanti8165,youtube
5 tahun yang lalu,Kak biken ganteng ngan pake kaca mata,@gunawanyusuf8601,youtube
3 tahun yang lalu,Dah 2021 nihh banggg,@salmamaulida2152,youtube
5 tahun yang lalu,Beli nya di grammedia mana bang?,@jasicaadilla1994,youtube
5 tahun yang lalu,"Yang ngerekam cewek yak? 
auto kepo",@daisythecoolest,youtube
4 tahun yang lalu,Ka sarah viloid nya mana?:>,@rreiinn,youtube
6 tahun yang lalu,Yang pegang siapa kameranya Mas bikin,@deborapulung9787,youtube
3 tahun yang lalu,"Bang nelson makan cokelat aku.pun bupeng juga makan cokelat, kwkwkwkwkwkkwkwkwkw!!",@Danisha3912_.,youtube
1 tahun yang lalu,Bang siapa yang rekam,@tanpanamai,youtube
6 tahun yang lalu,Abang  coklatkan manis wkwkwkw,@flowerchanofficial3572,youtube
